__filename__,is_fake,review
op_spam_v1.4/negative_polarity/deceptive_from_MTurk/fold1/d_hilton_1.txt,FAKE.DECEPTIVE,stayed day night normally easy going experience awful taking time actually write stay arrived clear carpet saw although bathroom superficial indicator housekeeping recently cleaned paper band across paper cap drinking clear actual cleaning took spot toilet seat kid remnant know people worked many year hotel industry always warned lazy housekeeping make thing clean fact make effort keep thing called downstairs sent chambermaid hour found room hotel outside cavernous awful echo lobby area created rarely eager leave place got washed clothes whether worn skeeviness favor stay clean
op_spam_v1.4/negative_polarity/deceptive_from_MTurk/fold1/d_hilton_10.txt,FAKE.DECEPTIVE,hotel located mile train station quite hike traveling luggage seem cash guest arrive private car charging exorbitant room feature either double king sized queen bed want little extra leg room price jump room kind view pay healthy
op_spam_v1.4/negative_polarity/deceptive_from_MTurk/fold1/d_hilton_11.txt,FAKE.DECEPTIVE,made reservation believing going staying classy hotel many stay went downhill moment checked one clerk front several guest already waiting ahead finally got checked located discovered neither room key worked make way back front finally made appeared nice enough went use bathroom found toilet manager moved new complain still finally able relax rest evening looking forward sleeping next front desk called wake call needless overall experience hotel left much desired choose accommodation next trip
op_spam_v1.4/negative_polarity/deceptive_from_MTurk/fold1/d_hilton_12.txt,FAKE.DECEPTIVE,people think think know wish half upon informed incompetent staff lost reservation auspicious find another new room view broadside adjacent willing let want following day got little harder ignore minor problem making undeserving luxury noisy rude state bathroom towel anything go upon doubt sheet changed even next time ignore hype stay somewhere service possibly
op_spam_v1.4/negative_polarity/deceptive_from_MTurk/fold1/d_hilton_13.txt,FAKE.DECEPTIVE,husband recently stayed stayed horrible front desk clerk phone sounded like personal call even acknowledge u least five got room went lay bed noticed black hair paranoid hotel pulled back sheet moved pillow around noticed several called new sheet said would send right actually took nearly second night decided try irish pub hotel called kitty husband love pub pie watery flavor server seemed annoyed complained offer taken great trip definitely highlight rude dirty room bad spend money elsewhere
op_spam_v1.4/negative_polarity/deceptive_from_MTurk/fold1/d_hilton_14.txt,FAKE.DECEPTIVE,wife booked room three weekend downtown hotel well known brand knew going pay little additional price expecting get quality expecting minutia case hilton reserved room king size available stuck queen size get reduced price made reservation expected accommodated change room key room key used supposedly lost front desk told go find key come back stair get new get back highly really need look key told end stay charge knew always check two week later checked credit card additional two hundred dollar charge call argue twenty minute took suffice say staying
op_spam_v1.4/negative_polarity/deceptive_from_MTurk/fold1/d_hilton_15.txt,FAKE.DECEPTIVE,hotel rated four diamond one would think would almost like staying palace royal thing hotel however royal known moment walked wife going become bigger headache first soon arrived check hotel clerk older nineteen red flag started going clerk extremely rude acting like chore even getting texting cell bad clerk pretty much ignored blatantly staring even wearing anything could considered skimpy cold wearing turtle neck sweater large fur lined diverting atention several time finally got room surprise learned one help u luggage clerk said managed easy finally got third floor suite reserved month looked forward resting long mention disgust already couple supposed room bed making took almost half hour couple front wife get straightened apparently night clerk bother following policy taken reservation computer give friend leaving printed card day could described finally given another room next floor thankful got wife went use bathroom dropped luggage hearing clinking sound bent look one bag could hit see empty beer bottle sticking call back give clerk piece mind heard wife cry wall bathroom several roach crawling around noticed something else sink almost made u leave sink plain used far less thrilled stomred back downstairs demanded money desk manager returned ever went talked u taking another free charge make room thankfully clean bug trash disgusting item laying despite lot smaller promised view room decided make wife went get cleaned long trip pulled laptop use called high speed internet even bothered used dial went least three time fast speed quick call desk informed person responsible internet gone day nothing could done instead worrying went get something eat onsite dinning yet met rude people either stared chest forgot half arguing seemed like forever getting found found even bother trying anything final straw got thing found another know would hire bunch rude employee barely high school clean know hotel deserve four diamond unless place shut way know run decent
op_spam_v1.4/negative_polarity/deceptive_from_MTurk/fold1/d_hilton_16.txt,FAKE.DECEPTIVE,high hope sad say outrageously expensive two people one expect pay park offer free instead pay get internet wait pm check though flight rent car airport hotel offer transportation hotel bar doubt stay
op_spam_v1.4/negative_polarity/deceptive_from_MTurk/fold1/d_hilton_17.txt,FAKE.DECEPTIVE,booked room two night stay upon arrival reservation could even provided hotel confirmation still another reservation shown space available settled room night long bad odor coming apparently cleaning solution used tainted needless poor experience one hesitant ever stay hotel let alone hilton please consider someplace else hilton
op_spam_v1.4/negative_polarity/deceptive_from_MTurk/fold1/d_hilton_18.txt,FAKE.DECEPTIVE,stayed hotel first absolutely horrifying first staff incredibly could lived person would get cell phone checking wanting pull hair room also smelled like sex cigar smoke bad convinced politician checked using cheap also looked dried snot shower mark never stay
op_spam_v1.4/negative_polarity/deceptive_from_MTurk/fold1/d_hilton_19.txt,FAKE.DECEPTIVE,stay quite might well ill tell towel scratchy service terrible terrible mean even desk checked ordered dinner room service received wrong order meal felt little sick bill charging stuff want ask overall hotel bad unpleasant give half
op_spam_v1.4/negative_polarity/deceptive_from_MTurk/fold1/d_hilton_2.txt,FAKE.DECEPTIVE,stayed two night hilton last time staying could believe hotel offer free wanted least paying stay website also touted clean room clean believe linen problem pillow know people also later found hotel allows think another part like clean hotel without allergy attack suggest opt somewhere else like nickel dimed end beware hidden try somewhere else worth money sneezing
op_spam_v1.4/negative_polarity/deceptive_from_MTurk/fold1/d_hilton_20.txt,FAKE.DECEPTIVE,located prime real estate downtown aged gracefully hotel around country opened period hotel maintain appearance luxury made luxury accord century lacking form fitness almost alone among major hotel forcing patron go elsewhere quick even nominal fee wireless internet use hotel room rare outrageous parking fee guest discourage towner making guest room different meaning unless staying admittedly fantastic executive paying premium prosaic hotel
op_spam_v1.4/negative_polarity/deceptive_from_MTurk/fold1/d_hilton_3.txt,FAKE.DECEPTIVE,stayed back hotel place meet arrived fifteen minute early check told room ready least another used hotel room ready well since wait decided grab drink one kitty must used almost whole hour waiting finally got room although great view anything speak even though paid extra towel call room service twice receive another two time air conditioner fee internet ridiculous phone service terrible could barely use internet next time area staying recommend hotel people want waste
op_spam_v1.4/negative_polarity/deceptive_from_MTurk/fold1/d_hilton_4.txt,FAKE.DECEPTIVE,boast one great fall cliche many different room supposed array choice king two lakeside view look good paper get pay huge fee seems like nice upgrade give nothing staff nice stay hotel go way seek casual dining atmosphere might nice college couple looking getaway next time stay looking
op_spam_v1.4/negative_polarity/deceptive_from_MTurk/fold1/d_hilton_5.txt,FAKE.DECEPTIVE,husband reserved room online looking quit day away home unfortunately found looking first room smaller appears online floor looked like cleaned check room stayed thin wall could hear conversation guest staff asked turn service never would recommend hotel great place visit long stay
op_spam_v1.4/negative_polarity/deceptive_from_MTurk/fold1/d_hilton_6.txt,FAKE.DECEPTIVE,stayed recent business elected go executive suite say barely anything get price expecting much better arrived around night checked get concierge service stop find odd hour stop service like especially expecting guest checked beyond took minute get first room missing key extremely frustrating tired presentation give next speaking next complimentary breakfast want stale muffin bad cup coffee stay next super wireless internet room actually pay top everything else horrible connection angonizingly slow staying every even though frequent top list horrible hotel experience long
op_spam_v1.4/negative_polarity/deceptive_from_MTurk/fold1/d_hilton_7.txt,FAKE.DECEPTIVE,really wish could say liked whole experience plain first warning sign made person spoke placing reservation absolutely idea first tried book wrong finally got sorted hotel actually booked wrong read right called back two day later confirm found given wrong get already bad feeling came actually staying people desk downright supposed room smelled strongly cigarette hotel staff refused believe let change room one smell might well stayed first short took four period front desk get sheet made obvious crumb fresh stain littered able get fresh like took several hour since pet friendly lucky got stuck room next room filled little wall paper could hear night complained staff refused believe said wall room thick able hear anything next yeah excited use like cleaned tried fitness half equipment tried cut stay course hotel work even refused comp stay grossness deal never stay sure let everyone know nightmare stay
op_spam_v1.4/negative_polarity/deceptive_from_MTurk/fold1/d_hilton_8.txt,FAKE.DECEPTIVE,family stayed hotel walking lobby expected good made way counter greeted knew may bad customer service person rude wait got room looked like someone checked high chair requested still spot food rest room water counter little toilet got settled went dining room supper disappointed service food quality price luckily stay one one day almost
op_spam_v1.4/negative_polarity/deceptive_from_MTurk/fold1/d_hilton_9.txt,FAKE.DECEPTIVE,disappointed front desk clerk personal call took get arrived room bed made last guest towel called front desk made come back twelveth floor new room downstairs clerk treated though done something arrived new room found bathroom less hair toilet shower curtain mildewed dried toothpaste allergy started bother immediately upon entering checked filter air looked like never comforter stained carpet looked like never saw waiting acceptable room went proved bad lettuce salad brown steak rare asked tasted like rotten veggie looked like cooked week earlier potato shriveled top whole experience went turn lamp final room electrocuted ambulance come get day hospital
op_spam_v1.4/negative_polarity/deceptive_from_MTurk/fold1/d_james_1.txt,FAKE.DECEPTIVE,went truly expected luxury experience exactly like gorgeous staff desk focusing well decorated hotel much dismay found quite arrived hotel late flight found clerk reading must fascinating took full minute look ask would making said gave voucher printed checked said single room already rented went say would pay extra two three person room wished stay grudgingly accepted two person option jet lag setting desperately needed get clerk offered walk saying looked tired trying navigate hotel would much easier got followed new carried briefcase apparent time hand ushered setting briefcase said needed anything phone next bed would give direct line room service without dial thanked closed looked around fully saw supposedly two person suite two twin bed covered ruffled blanket cleaning staff obviously quick look around area found bathroom toilet paper even complementary one left got ready looked around tv turned battery turned light rolled sheet blanket turned inside try find cleaner morning walked lobby asked check enough hotel one clerk morning cheerful blond cheerfully asked room number handed extra note baggage asked said anyone carried bag room filed baggage asked considered reasonable charge carrying suitcase room two floor riding said unheard offered change handed slip phone reason saying manager would handle complaint clerk signed wallet head throbbing headache lack
op_spam_v1.4/negative_polarity/deceptive_from_MTurk/fold1/d_james_10.txt,FAKE.DECEPTIVE,recently stayed trust never pay premium price expect first rate whole experience disaster though short lived could stay another arrived hotel wait receptionist finished playing phone service room wait lobby finally got room exactly call clean picture website nice enough furniture falling apart probably plenty space average person bed smaller mention ordered room service bring u wrong order took wall also paper thin got little heater helped block noise stopped working middle next sore uncomfortable hungry tired cold checked even stay
op_spam_v1.4/negative_polarity/deceptive_from_MTurk/fold1/d_james_11.txt,FAKE.DECEPTIVE,disappointed stay strict gluten free diet told hotel restaurant could accomodate time sat would explain dietary need ended send plate back gluten item wife sleep apnea made made sure ask room available outlet near bed could plug cpap assured arrived request room change outlet near wait lobby sometime room moved yet finished benig entirely horrific expected hotel supposed next time visit staying another
op_spam_v1.4/negative_polarity/deceptive_from_MTurk/fold1/d_james_12.txt,FAKE.DECEPTIVE,initially excited found employer sending could never imagined frustration irritation would heaped inept staff james reservation could found although made word manager given room previously agreed upon anyone make angry room bland spite boast attention design room mostly seeing stain convinced washed last attended stressful business meeting dining room complete cold undercooked food served disgruntled afterward decided relaxing spa treatment assured would enjoy purifying shower would primarily take place shower think must allergic oil broke hive next came five foulest smelling candle lit guess supposed make smell began choking odor minute walked masseuse directed lie bed next hand wandered little much sure certain area massage ever considered staying beg handful positive thing say suitcase full negative pending court case almost guarantee would regret staying know
op_spam_v1.4/negative_polarity/deceptive_from_MTurk/fold1/d_james_13.txt,FAKE.DECEPTIVE,would one worst hotel ever even though noticed design place extremely service quality hotel condition gave room blanket dirty looked used moment figured hotel busy started notice furniture came cost television working extremely especially coming rigorous day work wanting settled work instead frittering time noting got next wifi absolutely nothing stare furniture stare never going ever
op_spam_v1.4/negative_polarity/deceptive_from_MTurk/fold1/d_james_14.txt,FAKE.DECEPTIVE,luxurious nice hotel want stay wife booked cost one could get new honeycomb tablet dual core processor price room stylish looked bed although quite understand wifi would even need wifi experience bit mean food available tasty wait long line get ticket also hoping browse like without filling make
op_spam_v1.4/negative_polarity/deceptive_from_MTurk/fold1/d_james_15.txt,FAKE.DECEPTIVE,stay wife visiting family decided stay stayed happily came good room looked nothing like one pictured bathroom dirty bedding furniture also musty odor called front desk complain quite ended leaving staying different hotel duration
op_spam_v1.4/negative_polarity/deceptive_from_MTurk/fold1/d_james_16.txt,FAKE.DECEPTIVE,recent stay james revealed recent updating hotel facelift although room public area look hotel still need serious first room clean arrived room serious odor cigarette asked new room clean odor involve manager request new room better first severely could get temperature properly room always either hot cold two night hotel commanding rate expect room temperature comfort taken something constant mattress horribly room skipped new worn point indentation get lie sort sink matter basic comfort issue found hotel loud almost time spite calming noise level raucous conducive good unhappy accommodation would recommend avoid hotel even though convenient happier almost anywhere
op_spam_v1.4/negative_polarity/deceptive_from_MTurk/fold1/d_james_17.txt,FAKE.DECEPTIVE,hotel one better one stayed room seemingly nice staying day seemed like cleaning staff never came clean sheet three day called requested wall seem paper thin hear going adjacent interfered ate primehouse restaurant asked well done steak still pretty pink inside lacked definitely hotel would recommend
op_spam_v1.4/negative_polarity/deceptive_from_MTurk/fold1/d_james_18.txt,FAKE.DECEPTIVE,business trip coming wanted stay someplace really cause never made reservation two week advance safe side arrived record big said would take care get room right two hour later still sitting finally get room try everything nice decided take went wash called front desk asked hour later someone came maybe really finally get shower handle went front desk asked new room started implying broke said everything fine room earlier day must done something leaving hotel easiest decision made whole two thumb
op_spam_v1.4/negative_polarity/deceptive_from_MTurk/fold1/d_james_19.txt,FAKE.DECEPTIVE,look nice look employee extremely rude room would definitely advise staying
op_spam_v1.4/negative_polarity/deceptive_from_MTurk/fold1/d_james_2.txt,FAKE.DECEPTIVE,one worst hotel ever stayed good thing located forced stay longer receptionist rude room dirty towel found numerous small insect gym spa closed nothing done management accommodate next time take business
op_spam_v1.4/negative_polarity/deceptive_from_MTurk/fold1/d_james_20.txt,FAKE.DECEPTIVE,consistently disappointed throughout stay heard others even nice figured would problem booked guestroom long weekend visit according immerse date bath contemporary furnishing felt like showroom closing time busy everything front bit staff every way keen show bother handled bag far much convinced commitment also thought room quite pathetic looked distinctly like someone rolled around bed got bathroom fixture felt little bit gross smelled nobody cared complained suggested maybe would go horrible headache time lady ruined entire first evening price could stayed week economy gotten personal item treated still saved would treated like needless looking elsewhere go back may frequent patron luxury know wasting
op_spam_v1.4/negative_polarity/deceptive_from_MTurk/fold1/d_james_3.txt,FAKE.DECEPTIVE,stay hotel like price expect certain level pay well dollar think unreasonable expect quality also certain level standard perhaps hotel rename lebron much class twice handful baby powder thrown face would refreshing break level service received lebron night hell began whatever front faked assume intended british ended unholy melding australian new accent make made way past belvedere unusually also faint scent strong could definitely smell deep throbbing sound began emanate sounded like air conditiner despite many reassurance front throbbing continued throughout demanded man front desk come rectify situation could never
op_spam_v1.4/negative_polarity/deceptive_from_MTurk/fold1/d_james_4.txt,FAKE.DECEPTIVE,recently stayed returning anytime staff unfriendly say least price also fan fact allow pet enough space gym lack variety equipment limit option ultimately unimpressed service whole would recommend avoid
op_spam_v1.4/negative_polarity/deceptive_from_MTurk/fold1/d_james_5.txt,FAKE.DECEPTIVE,stayed hotel last vacation windy although hotel look service staff rude unprofessional helpful room service close pm plan getting hungry even though stayed whole week ask new towel extra never go back place
op_spam_v1.4/negative_polarity/deceptive_from_MTurk/fold1/d_james_6.txt,FAKE.DECEPTIVE,staff seemed determined make stay horrible entered establishment check clerk let half dozen people front even acknowledged thinking room service would relaxed room waited time reached cold wrong went pool find closed restaurant hotel recommended none regular channel bad stay
op_spam_v1.4/negative_polarity/deceptive_from_MTurk/fold1/d_james_7.txt,FAKE.DECEPTIVE,staying last weekend honestly say going affordability next terribly overpriced staff cold chair room looked like something love hotel definitely one better place believe would better happier staying holiday always get pay
op_spam_v1.4/negative_polarity/deceptive_from_MTurk/fold1/d_james_8.txt,FAKE.DECEPTIVE,huge let expecting truly spectacular website appears absolutely fabulous state art bad experience started right walked turn room reserved given someone man front desk extremely wait hour house keeping service prepare new room room odd smell ask towel hand soap already one thing good place fabulous feel paid way much next time look stay somewhere
op_spam_v1.4/negative_polarity/deceptive_from_MTurk/fold1/d_james_9.txt,FAKE.DECEPTIVE,uninviting looking comfort stay room like definitely restaurant site also modern scream would vacation especially afraid touch anything whole
op_spam_v1.4/negative_polarity/deceptive_from_MTurk/fold1/d_monaco_1.txt,FAKE.DECEPTIVE,hotel claim luxury certainly neither luxurious picture posted website imply guest going stay room amazing certainly case might actually quite tacky bathroom musty smell meet cleanliness standard hotel claiming top hotel fooled snappy website selective hotel live expect anything experience merely average
op_spam_v1.4/negative_polarity/deceptive_from_MTurk/fold1/d_monaco_10.txt,FAKE.DECEPTIVE,hotel hotel say found decor tacky hard time relaxing room designed clashing color found fact member reward club get free access annoying room smelled like wet canine hall kept u night perhaps dog would howled less room service waited hour half meaning get dinner wanted pm would stay view location money better place stay
op_spam_v1.4/negative_polarity/deceptive_from_MTurk/fold1/d_monaco_11.txt,FAKE.DECEPTIVE,stayed last truly glad never stay website great job creating room much smaller seems thought monaco walking distance nightclub wireless internet free extremely nt per parking way expensive would recommend hotel
op_spam_v1.4/negative_polarity/deceptive_from_MTurk/fold1/d_monaco_12.txt,FAKE.DECEPTIVE,looking true luxury hotel place stayed visiting friend decided treat luxury get check pleasant wait long front desk staff unfriendly room roach small mirrored headboard bed tacky motel fancy house cleaning service really pushy tried clean room asked come back gave whole minute came getting extra towel like pulling know thought going steal room service food ordered took forever delivered time received called front desk offer compensate send new restaurant bother try price menu room service experience assured worth really disenchanted plus dollar received mediocre accomedations poor spend money somewhere
op_spam_v1.4/negative_polarity/deceptive_from_MTurk/fold1/d_monaco_13.txt,FAKE.DECEPTIVE,decided spend extra money booking room monaco picture beautiful room waste say although requested room view must given worst room service skipped room second day call towel least twice someone finally came food outrageously expensive even hotel
op_spam_v1.4/negative_polarity/deceptive_from_MTurk/fold1/d_monaco_14.txt,FAKE.DECEPTIVE,arrived find room despite past pm check offered compensation real shunted side wait took good hour time needing reading room adequately clean better though sparsely furnished feel welcoming decoration reminiscent bad night spent south coastal encountered several problem site room staff tried helpful occasion rarely able make even complained third night rowdy seemed apathy cluelessness barely concealed abysmal service hotel bar elected eat every night declined try room unimpressed every offering would use hotel business personal
op_spam_v1.4/negative_polarity/deceptive_from_MTurk/fold1/d_monaco_15.txt,FAKE.DECEPTIVE,found stay hotel less lure fancy promising world service amenity turned picture website show grand lobby one would assume room received room way could barely found luxurious local motel mention let tell code faint urine smell throughout entire hotel awake night incessant would stay
op_spam_v1.4/negative_polarity/deceptive_from_MTurk/fold1/d_monaco_16.txt,FAKE.DECEPTIVE,sickening hotel stuffy masterpiece hotel done stayed recently room reek pretended elite class fill seriously afraid even lie sheet fear charged hefty linen stayed stayed hotel monaco one
op_spam_v1.4/negative_polarity/deceptive_from_MTurk/fold1/d_monaco_17.txt,FAKE.DECEPTIVE,business associate job wanted stay somewhere research online came across hotel decided stay arrived noticed busy part city bright staff offer much room city light kept room even curtain bed appeared offer much expected
