__filename__,is_fake,review
op_spam_v1.4/negative_polarity/deceptive_from_MTurk/fold3/d_fairmont_3.txt,FAKE.DECEPTIVE,recent weekend stay chose hotel scouring various hotel website look expectation felt website led one believe upon checked shown room first glance everything seemed fine settling began notice general lack noticed spiderwebs lack cleanliness advertised pod docking station work call bring guest call item checked ensure work properly guest check found restaurant site loud mention unusally long wait served inquire menu item waiter seemed lack knowledge menu experience good next time chose another hotel
op_spam_v1.4/negative_polarity/deceptive_from_MTurk/fold3/d_fairmont_4.txt,FAKE.DECEPTIVE,stayed good room cleaned haphazardly fashion pleasant walk called service desk towel brought took exceedingly long amount time brought woman delivered towel rude staying
op_spam_v1.4/negative_polarity/deceptive_from_MTurk/fold3/d_fairmont_5.txt,FAKE.DECEPTIVE,whenever decided stay thing mind idea taking time relax enjoy time hotel choice right front desk arrived problem room reserved occupied switch much smaller original hotel give u paid large room wanted hotel name put guest kind wo nt reserving room
op_spam_v1.4/negative_polarity/deceptive_from_MTurk/fold3/d_fairmont_6.txt,FAKE.DECEPTIVE,experience wife road trip stopped reservation park arrived room available wife pregnant time reception staff wife handle smell room asked refund go stay somewhere refused rude stay first thing next morning leave look different never stay hotel
op_spam_v1.4/negative_polarity/deceptive_from_MTurk/fold3/d_fairmont_7.txt,FAKE.DECEPTIVE,recently stayed one absolute worse travel experience ever one main reason originally booked stay fairmont property offered room suite supposed suffer extreme allergy really hate thought hotel room happy pay extra room supposed specially designed guest environmental tell right save got immediately detected distinct smell cigarette smoke add gross took look around noticed dust lamp light fixture well dirt comforter bed looked messy well someone recently used bed hastily threw comforter back way going stay made way back desk politely informed problem woman front desk told room available practically got yelling match grudgingly started typing away making wait another twenty finally informed could put another would four hour four absolutely hotel much less one constantly tout sort promise superior customer service ever treat customer recommend fairmont ever stay
op_spam_v1.4/negative_polarity/deceptive_from_MTurk/fold3/d_fairmont_8.txt,FAKE.DECEPTIVE,hotel supposed romantic get away turned got room offered anything drink eat meantime wait well minute said would clerk front desk twas texting cell totally time manager said would take care issue upgrade room waiting long believe dirty towel television wait repair guy fix hotel failed mention convention going spa mad writing owner letting really made taken vacation year expecting fairmont luxurious cater even concierge snickered like wear make mad even thinking least time enjoyable even though hotel
op_spam_v1.4/negative_polarity/deceptive_from_MTurk/fold3/d_fairmont_9.txt,FAKE.DECEPTIVE,recent stay hotel appalled service received supposedly high end arrived wait lobby minute someone came front desk check apparently desk clerk personal phone call boyfriend know going finally given key room away vending much chagrin room right next vending area heard guest going back forth ice machine nearly room obviously room blanket bed pillow reaked cigarette course told room available booked every room conference welcome check go another fitfull sleep awoke child running parent shower cold given two towel one could wait check informed manager duty complaint told would recommending hotel anyone would go online write review anyone interested would see understand highly rated hotel could far
op_spam_v1.4/negative_polarity/deceptive_from_MTurk/fold3/d_hyatt_1.txt,FAKE.DECEPTIVE,regency worst hotel ever went booked room went ahead gave room smoking going smelled heavy smoke really called front desk said nothing like record refused exchange room also blood stain bed carpet also would never book hyatt
op_spam_v1.4/negative_polarity/deceptive_from_MTurk/fold3/d_hyatt_10.txt,FAKE.DECEPTIVE,recent stay regency severely disappointed quality facility start room provide adequate sound barrier hoping spend quiet evening long day business hoped spend quiet night watching imagine real house wife full destroyed chance peaceful asked concierge address seemed concerned texting visited found stayfittm gym consisted nothing couple weight yoga water cooler quite workout towel stained feature touted website rendered null presence dust ball
op_spam_v1.4/negative_polarity/deceptive_from_MTurk/fold3/d_hyatt_11.txt,FAKE.DECEPTIVE,great difference hyatt regency normal thing like hotel smoke section non smoking section really close get really uncomfortable crowded people smoking lung even though hotel really nice nice great still good stay like people smoking beside
op_spam_v1.4/negative_polarity/deceptive_from_MTurk/fold3/d_hyatt_12.txt,FAKE.DECEPTIVE,room location hotel big staff take care heating room making difficult gym big hotel parking garage hotel many guest lobby loud relax get great service hotel bar ran bar snack many people bar later asked direction restaurant dinner reservation hotel staff asked know could get next cleaning staff tried get still
op_spam_v1.4/negative_polarity/deceptive_from_MTurk/fold3/d_hyatt_13.txt,FAKE.DECEPTIVE,stay regency experience never ever forget good actually pretty easy clerk went room looked seemed ok bushed flopped ohhhhh bed hard military bunk army tired passed course woke back figured hot soak tub would help back plugged turned hot water full poured shower put foot expecting real heat water barely called front desk clerk frustrated turned tv switched put hand vent see cold air saw something slimy inside looked like wet gray chunk take anymore went front desk complained seemed though guy something kept smiling empathy used hearing goop offered free night way stay place
op_spam_v1.4/negative_polarity/deceptive_from_MTurk/fold3/d_hyatt_14.txt,FAKE.DECEPTIVE,first checked website review completely sure would great hotel would great time totally disappointed got first asked nonsmoking room hate odor fact gave non smoking room smelled worse smoking smelly bad way smelled like sweat dirty laundry something like trying enjoy window dusty decided get room went pool nt expected either nothing picture went back room called room service complain smell dirt gave another room smelled even freak gave deodorant bed uncomfortable bathroom say
op_spam_v1.4/negative_polarity/deceptive_from_MTurk/fold3/d_hyatt_15.txt,FAKE.DECEPTIVE,friend stayed regency weekend visiting mutual friend hotel first glance nice quickly found room reeked smoke first stepped bathroom looked though cleaned mold around toilet film also large stain carpet immediately called front desk tell unkempt woman front desk rude assured u smelling permitted also told room cleaned several minute arguing moved another room took hour clean room available sit lobby baggage one made available food ordered restaurant horrible way waiter rude stopped table twice whole time staff hotel seemed unhappy barley even acknowledged never stay would never recommend hotel
op_spam_v1.4/negative_polarity/deceptive_from_MTurk/fold3/d_hyatt_16.txt,FAKE.DECEPTIVE,seemed like nice place like renovation cheap poorly done bathroom faucet leaky carpet bump staff trying find good cab guy behind front desk made wait minute finishing phone least called someone else help travel gave u wrong sized go find hotel located heart city meant found unsavory character along
op_spam_v1.4/negative_polarity/deceptive_from_MTurk/fold3/d_hyatt_17.txt,FAKE.DECEPTIVE,stay away regency recently spend weekend expected hotel provide experience beyond seedy dive bad part left arrived flight ready rest hour starting room ready hour perhaps inclement weather delayed flight also delayed hotel advised wait creatively named big seemed annoyed wanted seeming understand choice spent time hideously noisy wanted relax waited hour checking back front room ready seemed longer came boy behind desk certainly unable enlighten explained simply waiting room whatever make word nothing almighty spake nonsense final say requested presumably staff yet managed get ready admitted defeat slunk fewer regret would find better place spend park bench surrounded pimp thief would inviting found another better better room ready looking experience like book room regency want place look
op_spam_v1.4/negative_polarity/deceptive_from_MTurk/fold3/d_hyatt_18.txt,FAKE.DECEPTIVE,basically caters guest want feel like staying nice hotel soon enter come make big deal fact bedsheets undergo special simple washing machine good sort thing appeal folk enjoy picky narcissistic identify trait hotel even offer free essential feature business traveler like obviously intended guess
op_spam_v1.4/negative_polarity/deceptive_from_MTurk/fold3/d_hyatt_19.txt,FAKE.DECEPTIVE,recently stayed regency although stayed variety time business experience time particularly right checked day left felt like constantly around unfriendly people want work room dirty whole time even though maid came every trying sleep night loud next visit staying hyatt
op_spam_v1.4/negative_polarity/deceptive_from_MTurk/fold3/d_hyatt_2.txt,FAKE.DECEPTIVE,wife went enjoy weekend stayed ruined family holiday first diamond platinum need reserve room atleast day pay extra welcome credit give credit used rest talked manager said use next management hotel full cheap minded know hotel let use regency asked u pay using beware want enjoy weekend regency last place consider thanks
op_spam_v1.4/negative_polarity/deceptive_from_MTurk/fold3/d_hyatt_20.txt,FAKE.DECEPTIVE,ole room usually intended even worst case allergen got one first thing wife sneeze four upon setting channel scanning reception came fuzzy interattive ethernet feature lost confusion work provided u first pool bad maid seemed come go intercommunicative knock knock let right started one fluorescent bulb ceiling dimmer others crib mention hotel oh
op_spam_v1.4/negative_polarity/deceptive_from_MTurk/fold3/d_hyatt_3.txt,FAKE.DECEPTIVE,whilst doubt good location hotel fall short notably although lobby corridor floor well room dust lined carpeted floor room bed emitted unpleasant odor sheet changed furnishing nice various blemish upon close bathroom relatively exception view nice particular service relatively food restaurant average cleanliness time glass waiter promptly apologized returned new glass still inexcusable advertised high class make mistake staying
op_spam_v1.4/negative_polarity/deceptive_from_MTurk/fold3/d_hyatt_4.txt,FAKE.DECEPTIVE,wife stayed regency couple week ago defiantly go customer service horrible well apparent worker want arrived hotel told u room still cleaned wait almost hour gave u got room bed even properly cafe always crowded people take two hour get ended going home two day
op_spam_v1.4/negative_polarity/deceptive_from_MTurk/fold3/d_hyatt_5.txt,FAKE.DECEPTIVE,hotel full lobby full crowd night bar way people stumbling hotel hour yelling making lot staff little aware noise level booked room threatened make people lobby nothing asked water view got city people front desk accomodating horrible
op_spam_v1.4/negative_polarity/deceptive_from_MTurk/fold3/d_hyatt_6.txt,FAKE.DECEPTIVE,decided spend little extra stay hotel visiting son make mistake room smaller appear web place stayed best western air conditioner super loud wall paper people next room must party despite three call front desk security failed stop also thought front desk staff usually staff polite try people particularly personable seemed interruption work rather reason positive hotel location make negative save money stay somewhere
op_spam_v1.4/negative_polarity/deceptive_from_MTurk/fold3/d_hyatt_7.txt,FAKE.DECEPTIVE,expected bit stayed appalled condition room stayed linen toilet paper roll nearly empty spare lock door service left chocolate pillow think took piece already nearly empty toilet leaving would stay traveler
op_spam_v1.4/negative_polarity/deceptive_from_MTurk/fold3/d_hyatt_8.txt,FAKE.DECEPTIVE,recently stayed regency boy hotel look nice outside smell river smell bad one night almost made difficult sleep even think bathroom room looked like cleaned month stain towards end stay saw mouse ground floor could imagine critter may lurking
op_spam_v1.4/negative_polarity/deceptive_from_MTurk/fold3/d_hyatt_9.txt,FAKE.DECEPTIVE,recently stayed downtown three day experienced worst service made reservation upon arrival room already took u nearly two hour actually get room given wrong entered sheet stained seemed cherry going assume night town bummed money three homeless men outside arriving room hoping nice hot found note door note explaining hot early next morning awoken housekeeping dnd sign decided wake go come find car broken parking filed police report police asked manager video unfortunately u surveillance memory record needless say left early next day never return dreadful hotel ever
op_spam_v1.4/negative_polarity/deceptive_from_MTurk/fold3/d_omni_1.txt,FAKE.DECEPTIVE,really looking forward nice relaxing stay end long unfortunately moment arrived staff belligerent extremely lost reservation refused give u rate booked gone different hotel right hindsight finally got checked made wait needlessly minute decided go tiny kind walked way suit internet access really never stay save headache book somewhere
op_spam_v1.4/negative_polarity/deceptive_from_MTurk/fold3/d_omni_10.txt,FAKE.DECEPTIVE,latest business wife recently stayed omni hotel one deluxe think speak fully satisfied hotel advertises room resemble one see service certainly one plan stay expect service go beyond fresh towel bathroom check first room seemed need new filter first turned air coming seemed second fitness center open people like exercise certainly especially considering take much fitness center available around clock well similar would recommend one looking luxury
op_spam_v1.4/negative_polarity/deceptive_from_MTurk/fold3/d_omni_11.txt,FAKE.DECEPTIVE,enjoy stay omni man front desk extremely problem reservation gave family lot secondly finally got reservation sorted air conditioning unit room would go considering paid well per night romance package standard heading back omni hotel time
op_spam_v1.4/negative_polarity/deceptive_from_MTurk/fold3/d_omni_12.txt,FAKE.DECEPTIVE,never looking forward sightseeing business company arranged stay omni hotel located center magnificent arrived hotel gave pleased put luggage inquired told room ready yet hour tried lose temper pleasantly asked could another told convention going hotel every room would company account stayed somewhere pay service employee behind counter flippantly told take seat went back talking picked luggage plopped cushy chair leg front left side picked luggage moved another two hour passed given walked room first thing smelled cigarette mad explicitly asked feel like going back downstairs dealing idiot behind counter tried long tipped bellboy slammed door thought maybe could use air conditioning freshen went turn tired went thinking never stay hotel
op_spam_v1.4/negative_polarity/deceptive_from_MTurk/fold3/d_omni_13.txt,FAKE.DECEPTIVE,hotel one hotel heart city traffic service want wait room half hour place throughout whole bed made bathroom never hotel help looking nice place dine fun place give info activity going hotel listed top worst hotel waste time money staying omni
op_spam_v1.4/negative_polarity/deceptive_from_MTurk/fold3/d_omni_14.txt,FAKE.DECEPTIVE,staying omni honestly say take time book ahead next visit thrilled see beautiful hotel first seemed like would nice outside hotel room requested obviously smoked could still smell stale smoke told entire hotel supposed hallway smelled like cigarette top room service brought u wrong checked saw still tried chage u even sent would also point avenue bad spot hotel claim high right outside hotel drug dealer even go gas station scared leave pool closed first night convention hotel thus keeping u using hot tub looking forward price room would say place definite learned lesson check room agree stay next place get star
op_spam_v1.4/negative_polarity/deceptive_from_MTurk/fold3/d_omni_15.txt,FAKE.DECEPTIVE,staying omni hotel nothing obviously spends much money marketing convince people luxurious enough actually making hotel hotel room devoid calling front took three hour two call finally get fresh towel top went connect internet wifi signal weak forced go hall connect exorbitant price charged one night corner could stayed week holiday wish
op_spam_v1.4/negative_polarity/deceptive_from_MTurk/fold3/d_omni_16.txt,FAKE.DECEPTIVE,first get room lower garbage pick make ton noise wake bother going breakfast time restaurant open finally breakfast arrived cold nothing like congealed egg start fitness center towel cup also hot many people sweated much congealed really entire three day visit like tried room service service slow food warm high speed internet high speed would connect furniture run pool towel always price would expect better service better maintained
op_spam_v1.4/negative_polarity/deceptive_from_MTurk/fold3/d_omni_17.txt,FAKE.DECEPTIVE,horrible experience stayed hotel last first plasma tv room broken staff said room particularly apologetic supposedly tell people smoked room indoor swimming pool closed due high chlorine really looking forward using supposed maid knocking asked would thought quite ever stay place
op_spam_v1.4/negative_polarity/deceptive_from_MTurk/fold3/d_omni_18.txt,FAKE.DECEPTIVE,last booked omni hotel weekend stay took package wait check intolerably letting people check allergic sure fur dander got spread room insisted escorting every time came like going break another room anytime room watching like asking needed know time anyone think went full screaming went could hear television next room even let smoke privacy room relieve threatened throw gave hundred hard earned go probably dog went restaurant given already paying arm leg food stay waste
op_spam_v1.4/negative_polarity/deceptive_from_MTurk/fold3/d_omni_19.txt,FAKE.DECEPTIVE,boyfriend checked room omni irritated see bed looked kid jumping first glass bathroom lipstick smear saw roach behind given hotel night stay decided deal ordered munchies chip dip smelled coming back convenience store beer fresh able enjoy would recommend place
op_spam_v1.4/negative_polarity/deceptive_from_MTurk/fold3/d_omni_2.txt,FAKE.DECEPTIVE,recently staying omni waste room typical standard want pay unreasonable amount one premier service staff nothing rave idea service waiting lobby minute waiting anybody help carry heavy luggage sorry say short think money would better spent staying
op_spam_v1.4/negative_polarity/deceptive_from_MTurk/fold3/d_omni_20.txt,FAKE.DECEPTIVE,recently stayed omni hotel arrived room two hour later finally entered saw brought cot requested asked never brought mattress like sharing even work terribly hot next morning ate continental breakfast low quality burnt flavorless would recommend hotel
op_spam_v1.4/negative_polarity/deceptive_from_MTurk/fold3/d_omni_3.txt,FAKE.DECEPTIVE,idea considered four star omni age room dingy plain worn say room switch original room terrible musty almost like permeated first room brought tear staff seemed rather indifferent finally agreed switch u another new one clearly past housekeeping almost call back day trip empty trash forget leave towel one kind money spent weekend expecting least little luxury special received neither returning omni
op_spam_v1.4/negative_polarity/deceptive_from_MTurk/fold3/d_omni_4.txt,FAKE.DECEPTIVE,hotel pretty advertise first really difficult get located town fail mention traffic finally make hotel wait like minute front desk take care arrived one person desk people checking thought wait time make matter need internet connection day technical problem internet working two hour later managed get connection still hotel might look nice service meet disappointed never stay go back rating would give star
op_spam_v1.4/negative_polarity/deceptive_from_MTurk/fold3/d_omni_5.txt,FAKE.DECEPTIVE,wife stayed omni hotel customer training nearby ended staying night service awful first coming mildewy smell fortunate enough bring potpourri spray u continental breakfast morning terrible egg runny coffee hot make matter even room service attendant get room middle wife back exploring simply unacceptable
op_spam_v1.4/negative_polarity/deceptive_from_MTurk/fold3/d_omni_6.txt,FAKE.DECEPTIVE,stay family stayed weekend staff rude acted like bothering room looked nice photograph got room looked like dusted overall bad service worth
op_spam_v1.4/negative_polarity/deceptive_from_MTurk/fold3/d_omni_7.txt,FAKE.DECEPTIVE,never stay lured picture showing fabulous instead arrived find cheap furniture smelled old called front desk see another room put hold five minute one came back ended going front desk ignored given assistance interrupted front desk clerk seemed personal clerk apologize looked attitude requested another room mine smelled like old informed room available would send housekeeping sprayed febreeze couch tried relax turning tv sat bed saw something scurry checked corner mattress found packed bag left get refund room went across town marriott much better
op_spam_v1.4/negative_polarity/deceptive_from_MTurk/fold3/d_omni_8.txt,FAKE.DECEPTIVE,would never stay hotel call even provide basic amenity would comfortable staying bathroom cleaned properly sheet
op_spam_v1.4/negative_polarity/deceptive_from_MTurk/fold3/d_omni_9.txt,FAKE.DECEPTIVE,extremely disappointed stay omni hot summer day turned shower drip hot water came called complain assured someone would room fix shower show use felt person spoke rude accepting talking waiting minute bell hop came show use service could get shower work either apologized problem expected tip complained give nobody came told could switch different pack belonging move another shower work view city first looking brick plus party next room loud kept complained hotel staff told vip could anything hotel overpriced stay go omni stayed night motel better
op_spam_v1.4/negative_polarity/deceptive_from_MTurk/fold4/d_homewood_1.txt,FAKE.DECEPTIVE,stay suite downtown without doubt one worst hotel experience week long although reservation made month suite resulting stay another hotel first room disappointed cleanliness limitation barely large enough move utensil cook pool open limited bothered bringing night kept awake noise coming adjacent room traffic overall experience stay overpriced book ever
op_spam_v1.4/negative_polarity/deceptive_from_MTurk/fold4/d_homewood_10.txt,FAKE.DECEPTIVE,husband sorely disappointed requested non smoking right hit stinch stale cigarette opened front desk responsive need finally get moved new water pressure shower hardly enough get shampoo hair bed disappointed workout small decided swim lap got pool look like maintained needless say make mistake staying homewood suite
op_spam_v1.4/negative_polarity/deceptive_from_MTurk/fold4/d_homewood_11.txt,FAKE.DECEPTIVE,wife californian met student university celebrate th decided travel back windy city revisit place frequented first falling came knew wanted suite little else wanted revisit city intend spend much time spend much time researching big stay suite could took full two hour prepare even though booked month wife found dead cockroach staff rude chocolate included romance package could cost hotel cleaning staff failed show front desk offered apology little suffice checked never seen truly stay
op_spam_v1.4/negative_polarity/deceptive_from_MTurk/fold4/d_homewood_12.txt,FAKE.DECEPTIVE,stayed homewood suite downtown last extremely disappointed breakfast buffet minimal seem frequently came downstairs minute end breakfast period find half food option completely milk provided coffee cereal kept would better bringing layout room extremely move furniture around able watch move back could make dinner comfortably use room could barely close door bedroom past corner would expect hotel
op_spam_v1.4/negative_polarity/deceptive_from_MTurk/fold4/d_homewood_13.txt,FAKE.DECEPTIVE,stayed husband suite wanted something nice anniversary thought solid name brand expected pleasant unfortunately staff rude took lobby smelled musky room like hotel stayed carpeting atrocious color room smelled smoke though advertised long brown hair grossed call rude staff ask linen changed gave u huge attitude even get started poorly nice anniversary went totally awry due crummy hotel could give
op_spam_v1.4/negative_polarity/deceptive_from_MTurk/fold4/d_homewood_14.txt,FAKE.DECEPTIVE,stay would certainly expected especially due price paid room way hotel upon arriving hotel found one receptionist working busy texting mobile phone check wait min checking made feel like inconveniencing finally got room non smoking reservation room stank smoke several visible cigarette burn comforter called reception confirm non smoking advised argue receptionist room min agreed switch room another one entered new found stank exhausted flight decided would sort reception bad curled went sleep awoke go bathroom around noticed leg covered red immediately rushed back bedroom back cover find bed teaming bed packed stuff checked however refund since contacted head office awaiting stay
