__filename__,is_fake,review
op_spam_v1.4/negative_polarity/deceptive_from_MTurk/fold5/d_palmer_2.txt,FAKE.DECEPTIVE,three year old son arrived palmer last weekend hotel looked elegant online included information also indicated child check staff cold seemed quite annoyed son merely saying hi asking name person helping one elevator broken long wait hallway appeared bit dirty made way room deluxe website indicated would comfortable view long day sight seeing play son elected return room room service menu room restaurant room service came ordered adult food arrived hour cold wait another although hotel look service staff cold except cleaning staff might ok couple business traveler stay comfortable motel might
op_spam_v1.4/negative_polarity/deceptive_from_MTurk/fold5/d_palmer_20.txt,FAKE.DECEPTIVE,upon entering hotel room palmer immediately turned nose foul odor coming placing bag poorly made bed walked bathroom find last visitor failed flush immediately called room service asked new apologetically told room available would send someone right handle oh around half hour waiting angry maid knocked seemed irritated deal mess looked one dealing room cleaned turned asking hesitated angrily stormed thought thing would run smoother tried relax yes use ipod room however fail mention constant white noise signal nothing could compare remote control heating able get button remote work temperature seemed change wanted hot air would slowly get colder vise giving nice television program decided retire egyptian say found early check new hotel within next value back rent room
op_spam_v1.4/negative_polarity/deceptive_from_MTurk/fold5/d_palmer_3.txt,FAKE.DECEPTIVE,picture website sure real life palmer nearly pretty made cleaning staff still arrived room made u wait outside still granted minute sometimes guest messy thought weird thing would put charged u fee even one told u would pay liquor also get call u missed tour bus almost whole day spend extra buck cab fee could see city way good tour guide got husband lost key room one point trip desk gave hard time getting new certainly staying
op_spam_v1.4/negative_polarity/deceptive_from_MTurk/fold5/d_palmer_4.txt,FAKE.DECEPTIVE,although architecture hotel positive terible guest service unhelpful inbuilding resturaunts unsanitary seemed sheet cleaned last stay never intend except ask money
op_spam_v1.4/negative_polarity/deceptive_from_MTurk/fold5/d_palmer_5.txt,FAKE.DECEPTIVE,hotel though problem accommodation mentioned website accurate supposedly luxury comfortable hotel offer nothing much affordable difference palmer house affordable go hotel fancy go get good want sight go like hotel worth
op_spam_v1.4/negative_polarity/deceptive_from_MTurk/fold5/d_palmer_6.txt,FAKE.DECEPTIVE,pleased recent stay palmer house room ready upon arrival room given requested room queen size bed lower floor given air conditioning room functioning properly could turned room overpowering fragrance smell made sinus act wondered happened room got make housekeeping staff use much air doorman available cart lug suitcase dragging foot going get one lose sight point since contained valuable irreplaceable luckily another guest saw predicament offered room evidence previous occupant left behind overlooked housekeeping promised send someone take care debris call front desk finally gave looked forward stay conclude simply live advertising poor value money spent stay
op_spam_v1.4/negative_polarity/deceptive_from_MTurk/fold5/d_palmer_7.txt,FAKE.DECEPTIVE,visit started wrong foot entered lobby struggling carry luggage instead group hotel employee stood watching laughing trouble locating room paying night expect able walk around bed also wall thin could hear neighbor talking next hotel probably beautiful seems outdated due staying
op_spam_v1.4/negative_polarity/deceptive_from_MTurk/fold5/d_palmer_8.txt,FAKE.DECEPTIVE,though grand hotel seems disappoint certain staff seemed snooty request upgrade fulfilled repetitive initial room cost paid would expect coffee free internet service least even regular levy charge rip thing matched location staff made stay
op_spam_v1.4/negative_polarity/deceptive_from_MTurk/fold5/d_palmer_9.txt,FAKE.DECEPTIVE,palmer house look good actually disaster went lobby room smelled thoroughly requested lady phone scoffed said send took hour hotel good example pay always
op_spam_v1.4/negative_polarity/truthful_from_Web/fold1/t_hilton_1.txt,FAKE.TRUTHFUL,gucci sunglass stolen bag filed report hotel security anxious hear back liked hotel great time room really double bed comfortable hideaway great view lake hotel charged u check early
op_spam_v1.4/negative_polarity/truthful_from_Web/fold1/t_hilton_10.txt,FAKE.TRUTHFUL,gorgeous hotel outside reached elevator thing started look quite bathroom room grout need deep scrubbing overall appearance wireless internet additional even roach motel offer wireless fitness room available per thought room rate enough cover used coffee supply called next morning requesting told area would send nearly minute later got cream glad big definitely staying next door half cost lot better accommodation next time
op_spam_v1.4/negative_polarity/truthful_from_Web/fold1/t_hilton_11.txt,FAKE.TRUTHFUL,hotel impressive upon entering staff however felt room dated worn air conditioning seem working turned thought would cool first night interrupted phone call one happened time realized air working fussing control kick next morning mentioned concierge issue think mention issue air appeared seeing site several hour hot looking forward resting cool room going show room called maintenience come determining unit needed motor another hour get rest cool room going feel offer made u also surprised wifi free service staying next trip
op_spam_v1.4/negative_polarity/truthful_from_Web/fold1/t_hilton_12.txt,FAKE.TRUTHFUL,going internet retailer last minute hotel left available shuttle first reading know got ripped night priceline folk sniping room got free hotel get nice matter much money dump shower head really low water pressure decent part town hype bar close review reason ended two double bed asked time traveling traveling make sure get better deal confirm exact need reservation phone person super high hope room neither par business class nd floor called executive good fit romantic nt even spacious enough last minute get awayers trying save
op_spam_v1.4/negative_polarity/truthful_from_Web/fold1/t_hilton_13.txt,FAKE.TRUTHFUL,checked rm next woke bed bug arm reported management assiged u promised get room inspected care insisted get clothes one security guy came first even offered apology missed couple meeting next called forgot something previous discover room already assigned next much
op_spam_v1.4/negative_polarity/truthful_from_Web/fold1/t_hilton_14.txt,FAKE.TRUTHFUL,expected glamorous room walked housekeeping management must concerned attention detail like staying somewhere air room go past closet brass bed little bigger showerhead barely put might spoiled staying stay hotel year severly free breakfast room change get stay
op_spam_v1.4/negative_polarity/truthful_from_Web/fold1/t_hilton_15.txt,FAKE.TRUTHFUL,stayed host conference arrived tried find room program advertised corporate called reservation number client service representative answered hotel fitness explained inquiring room advertised put hold came back minute later told thing call property got asked could reserve treadmill arrived treadmill went tour fitness room first night found close returned center next day discovered charge per day use fitness track locker room use pay per charge noted anywhere guest service material food conference one room service meal pretty one conference lunch session wait staff made much noise hear hvac work well room kept window open three night bed comfortable nice tried get late offered card woman answered phone would give range advertised best service received folk security hotel safe guest became friendly security office locked laptop conference session every time carry visit least year personal travel continue stay marriott wish done
op_spam_v1.4/negative_polarity/truthful_from_Web/fold1/t_hilton_16.txt,FAKE.TRUTHFUL,stayed pulled cover small dark brown insect size grain either bed bug trapped glass attached called front housecleaning person claimed absolutely horrible service hotel management respond failing follow promise made setting aside bug caution window quite could hear lot street made hard mention worrying insect even changing night strongly encourage check
op_spam_v1.4/negative_polarity/truthful_from_Web/fold1/t_hilton_17.txt,FAKE.TRUTHFUL,stayed last week highlight stay waiting minute bellman come get year old year old gave dragged valet parking easy security guard kind enough hold door valet parking attendant looked ignored far could standing let go bag without everything falling gave son parking attendant pointed car parked short distance year old tell pull less irritating pool part athletic two lane reserved adult wanting lap two adult take pool everyone else consigned leftover ridiculous family pool close pool close stayed one single additional bar bottle coffee
op_spam_v1.4/negative_polarity/truthful_from_Web/fold1/t_hilton_18.txt,FAKE.TRUTHFUL,stayed attending conference room sufficient coffee compliment rate breakfast use unacceptable paying per thank goodness ice restaurant bar monitor room silly turn random time night incredibly wearing overcoat entire despite complaint room store cold item ice channel flat soooo bored spend hour paying least provide full
op_spam_v1.4/negative_polarity/truthful_from_Web/fold1/t_hilton_19.txt,FAKE.TRUTHFUL,elegant comfy nice sheet given little room th floor view monstrous venting located lobby heard elevator one charged internet access device per stayed middle received total access drink water try breakfast staff course tip give u cot free asked room couch party use gym pool th looked nice view water though right grant tried view firework higher
op_spam_v1.4/negative_polarity/truthful_from_Web/fold1/t_hilton_2.txt,FAKE.TRUTHFUL,month prior reservation requested room allowed lot natural facing open close reservation made conference travel confirmed request telephone day advance directly hotel clerk noted told would difficult consulted chart appeared satisfied room assigned surprised open door onto room inside one tucked dark facing wall called desk immediately told hotel sold hard tell room still available suited someone would call one call yielded similar one point told could sofa reduced could go see room committing real hospitality worried bad sofa bed could worse rooming ended staying dreadfully dark asked bright room one bed got dark room two redeeming feature room tight quarter tiny two uncomfortably low desk light fixture much brighten thing since really wanted bright environment wake early start workday cheerful office call instead got spent little time possible room next time conference absolutely stay another much better location looking percentage place much better chance bright room well better customer shame
op_spam_v1.4/negative_polarity/truthful_from_Web/fold1/t_hilton_20.txt,FAKE.TRUTHFUL,recently stayed third stay issue rd day stay requested room serviced returned thought clean getting bed cut piece glass must first person cut room found dried blood bathroom floor noticed notified staff asked room vacuumed bathroom returned room find dried blood still making complaint customer service gotten reply considering price point downtown hotel would think would try live star rating instead failed luckily many hotel choose downtown
op_spam_v1.4/negative_polarity/truthful_from_Web/fold1/t_hilton_3.txt,FAKE.TRUTHFUL,room smelled badly stale cigarette allowed change concierge staff telling long winded personal story uninterested guest long line location hotel would still nice place stay customer service
op_spam_v1.4/negative_polarity/truthful_from_Web/fold1/t_hilton_4.txt,FAKE.TRUTHFUL,stay time business first stay pretty much stay property stayed ton way clean front desk staff doubletree guest even superior less compared property room well bathroom room smaller tv hallway executive floor noisy night breakfast get like hampton inn star going like far better
op_spam_v1.4/negative_polarity/truthful_from_Web/fold1/t_hilton_5.txt,FAKE.TRUTHFUL,sister stayed nd refrigerator hallway first three beat old dorm told concierge going post picture took tripadvisor thing get breakfast dish left outside room stay floor day two night chime make supposed comformting relaxing rather wifi matter tell paid still unable get sister split already paid first night form deposit gave room cost city tax know comfort block away significantly view worth
op_spam_v1.4/negative_polarity/truthful_from_Web/fold1/t_hilton_6.txt,FAKE.TRUTHFUL,called edit existing placed hold finally someone came phone transfer put hold another finally get speak going asked send revised copy reservation huffed acted put able disconnect said one replied working front desk customer pathetic hotel better find better employee guest truly enjoy
op_spam_v1.4/negative_polarity/truthful_from_Web/fold1/t_hilton_7.txt,FAKE.TRUTHFUL,visiting busy day conference hotel booked full hotel allows meet wide array everyone complaining overall location hotel employee many cool property choose never stay hilton general
op_spam_v1.4/negative_polarity/truthful_from_Web/fold1/t_hilton_8.txt,FAKE.TRUTHFUL,bad diamond expect slightly room two double bed distraught come ditto continental breakfast executive nothing fattening bagel inn free breakfast put lounge opening business traveler often need gone sitting meager wifi pain somehow got stuck plan even though selected basic get started offer free wifi hilton tower seemingly two bathroom per one hotel unseemly waste especially room bathroom fixture scream tv flat huge disappointment conrad
op_spam_v1.4/negative_polarity/truthful_from_Web/fold1/t_hilton_9.txt,FAKE.TRUTHFUL,week long stay south michigan attending hotel elegance meeting room lounge hotel room could definitely use would definitely say price room room top car misplaced valet reservation messed hotel staff showed repeatedly throughout week door item new coffee would stay property much better place money close proximity big hotel time felt like staying faulty
op_spam_v1.4/negative_polarity/truthful_from_Web/fold1/t_james_1.txt,FAKE.TRUTHFUL,parent booked five night james location good terrible first night defective air conditioning much sympathy management sent engineer three time repair insisted getting cooler rationale summer temperature high filter hotel staff moved lower floor queen instead king neither rate discount effort compensate inconvenience hotel insisted fully booked reluctantly gave book hotel view room except window
op_spam_v1.4/negative_polarity/truthful_from_Web/fold1/t_james_10.txt,FAKE.TRUTHFUL,ate restaurant last picked last year food service prime house year service felt waitress even asked eating room hotel felt bed bathroom maintenance service turndown night staff hotel friendly impressed quality hotel
op_spam_v1.4/negative_polarity/truthful_from_Web/fold1/t_james_11.txt,FAKE.TRUTHFUL,returned staying park stayed four fairmont heard little james primehouse paid room mentioned room stayed double toilet broke tub nt drain showering huge bathroom door almost heavy close broke several closet door curtain close drawer space clothes room small non much like staying ikea without window outside terribly dirty elevator dirty staff however top notch exceptionally helpful room huge plasma tv way hotel star room rate close night way paid mentioned rate half
op_spam_v1.4/negative_polarity/truthful_from_Web/fold1/t_james_12.txt,FAKE.TRUTHFUL,recently returned trip husband baby another couple room hotel quite nice negative experience front desk staff including arrived took hour check requested two room hotel staff confirmed number time prior arrived could accommodate u offered nothing u make eventually persisted gave u half room one three night also asked concierge make u reservation brunch restaurant would accommodate adult two baby got restaurant reservation adult make special arrangement fit baby also asked hotel make u appointment personal shopper bloomingdales order u save time filled form advance direct shopper arrived appointment bloomingdales advised u received application moment pulled together complaining manager hotel disappointment advised would send something room never making return visit housekeeping location room quite nice experience
op_spam_v1.4/negative_polarity/truthful_from_Web/fold1/t_james_13.txt,FAKE.TRUTHFUL,disapointed service quality travel quite frequently never happen star reserved king informed king basically offered type compensation arrived room air conditioner door open rattled tv call following day returned work pm found room even stay somewhere
op_spam_v1.4/negative_polarity/truthful_from_Web/fold1/t_james_14.txt,FAKE.TRUTHFUL,sister best friend went stay summer said spacious room could barely walk said double well one pull tiny took forever day check people blamed u throwing book window somehow someone knew exactly fell would nt stay
op_spam_v1.4/negative_polarity/truthful_from_Web/fold1/t_james_15.txt,FAKE.TRUTHFUL,stayed deluxe king desk work sit eat room service table coffee table height couch strange futon lower coffee table canted incredibly uncomfortable sit ridiculous room service meal work since room configured like deluxe king suite depicted line assume design flaw run throughout bed fine bath fine imagine business traveler would rate property seating worst encountered modern
op_spam_v1.4/negative_polarity/truthful_from_Web/fold1/t_james_16.txt,FAKE.TRUTHFUL,hotel belong league four ritz like staying overpriced w staff nice lobby two small elevator several time elevator full time reached forced take hotel must flooding travel website high
op_spam_v1.4/negative_polarity/truthful_from_Web/fold1/t_james_17.txt,FAKE.TRUTHFUL,actually stayed already disappointed customer visit quite often usually stay yesterday read online article advertising state buy gift certificate hotel match amount used toward none article gave expiration date next trip thought give travel frequently pet heard liberal today went online bought one track mind somehow missed part credit expiring realized mistake immediately called hotel front desk explain said overseas business asked could extend credit extra refund gift certificate made purchase minute even recieved email confirmation business offer hr grace girl front dest extremely rude basically saying problem even bother act polite pretend sympathetic situation know kind service expect might call wash stay usual try hotel hear great service good pet
op_spam_v1.4/negative_polarity/truthful_from_Web/fold1/t_james_18.txt,FAKE.TRUTHFUL,hotel worth moment walked hotel lobby check staff rude room certainly live pompous bathroom porthole sliding door odd tiny would come
op_spam_v1.4/negative_polarity/truthful_from_Web/fold1/t_james_19.txt,FAKE.TRUTHFUL,reservation room adult got room corner room extra night cold able change even though switched went night loud morning uploaded something infront window stood vertically spend night came year ago better area good walking distance famous shopping clean next time looking quiet hotel
op_spam_v1.4/negative_polarity/truthful_from_Web/fold1/t_james_2.txt,FAKE.TRUTHFUL,degree heat suck air conditioner maintenance men attempted rectify issue offered portable fan low speed sound helicopter hoovering requested room change unsympathetic night front desk attendant stated possible hotel maybe manager could help next day went call called front one aware approximately minute manager returned call stated double room accepted anything better room cool degree middle paritally bathroom door new room thank boyfriend past shy part room believe first guest complain air unfortunate continued place guest offer reufunds perk sleepless night hotel need major
op_spam_v1.4/negative_polarity/truthful_from_Web/fold1/t_james_20.txt,FAKE.TRUTHFUL,stayed th location excellent shopping also room size college dorm plus completely white wall absolutely color except one accent sterile th floor lobby elevator dark done red balck minimal looked like entrance haunted staff nice would return
op_spam_v1.4/negative_polarity/truthful_from_Web/fold1/t_james_3.txt,FAKE.TRUTHFUL,james considered chic lost small room filled cheap ikea type tiny bathroom flooded water escaped shower shower flushings neighboring room sounded like protective levy small elevator could handle many u forced walk several flight stair rather wait extended period thin window could contain street noise sidewalk conversation heard throughout rather provocative listen couple next door also rather tacky took minute valet bring car checked hotel lost difficult time competing new soho try open new yorkers tolerate shabby
op_spam_v1.4/negative_polarity/truthful_from_Web/fold1/t_james_4.txt,FAKE.TRUTHFUL,returned night stay requested high quiet neither request window well car horn siren continued night first night two drunk party woke u safe room someone locked one picture tv leaving screw sticking light next impossible small alcove stained bench room key card returned lobby recoded upon returning work stood trying finally succeeded help bathroom small steam cover unless leave bathroom door night one small cookie left second supposed split inch diameter phone rang requested woken concierge know way get gave u longer route stayed much better hotel elegant worth definitely worth live used city
op_spam_v1.4/negative_polarity/truthful_from_Web/fold1/t_james_5.txt,FAKE.TRUTHFUL,several day prior called spoke length concierge made breakfast order bring breakfast called stated never got advance order finally bring brought wrong brought wrong order inconvenienced dining staff ordered room service food limp ordered soup arrived without called dining request told one would minute waiter arrived explained already food need menu needed audacity argue respectfully requested return spoon agreed another minute one bowl cold later decided call dining back request send someone argued expressed already sent someone explained received menu spoon another minute spoon finally thanks charging could argue flavorless addition gross customer surly sorry found room woefully reeked exhaust fume much night woke specifically requested booked reservation keep away right next elevator displeasure listening ding night long guest came
op_spam_v1.4/negative_polarity/truthful_from_Web/fold1/t_james_6.txt,FAKE.TRUTHFUL,stayed go hotel last trip make think time start looking location trader across street healthier great easy walk door staff friendly overall feeling turn service cookie free wifi worked varying degree throughout claim star mean better star online star used kiehls toiletry large bottle attached wall get share guest stayed room would expect holiday star asked switch booked still website claimed reason went communal bottle route hard like hotel making effort green still incandescent light housekeeping leaf light radio turn recycle obviously trying cut room need looking somewhat third floor room quite loud motorcyclers trying prove manhood front take stair stairwell straight horror even though wait one two elevator might phone staff fairly rude like questioning toiletry feel bad giving low really come close expectation previous stay start trying new hotel
op_spam_v1.4/negative_polarity/truthful_from_Web/fold1/t_james_7.txt,FAKE.TRUTHFUL,booked one night stay new year eve two u stay brief thing wrong stay prevent u returning advising friend stay shoddy construction room ceiling light missing leaving hole wire towel rack fell wall without bathroom door often came sliding mechanism gentle reported employee simply put towel rack back wall without properly adhering upon record paying though noted reservation made pay gift extremely wrote letter management manager available speak u receive adequate
op_spam_v1.4/negative_polarity/truthful_from_Web/fold1/t_james_8.txt,FAKE.TRUTHFUL,hotel definitely match receptionist unhelpful feel welcome booked upon receptionist told room course argued reluctantly gave tried charge upgrade fee requested completely go argue receptionist agreed take away room quite tv call someone fix wireless network banned ip talk tech support quite knowledgeable helpful guess bright point
op_spam_v1.4/negative_polarity/truthful_from_Web/fold1/t_james_9.txt,FAKE.TRUTHFUL,husband conference booked room thru called confirm u night instead easily first morning day phone called every day every day said would fixed got back never dial unable call call car call room last night someone came room fix hotel room great everyone even complaining great gym area love money could easily find another hotel nice working
op_spam_v1.4/negative_polarity/truthful_from_Web/fold1/t_monaco_1.txt,FAKE.TRUTHFUL,stayed hotel would come home night rather outdoor concert closest used half bottle shampoo first second staff refreshed bar soap informed front desk made apology said would take care got home night tiny tiny bar soap replaced shampoo original nicely exact bottle shampoo hotel great location navy pier michigan grant rather stay hampton would recommend hotel
